{
  "$schema": "https://json-schema.org/draft/2020-12/schema",
  "title": "Email Builder State",
  "type": "object",
  "required": [
    "modules"
  ],
  "properties": {
    "campaignId": {
      "type": [
        "string",
        "null"
      ]
    },
    "templateId": {
      "type": [
        "string",
        "null"
      ]
    },
    "previewBranchKey": {
      "type": [
        "string",
        "null"
      ]
    },
    "templateContext": {
      "type": "object",
      "required": [
        "mode",
        "resolvedBaseTemplateId"
      ],
      "properties": {
        "mode": {
          "type": "string",
          "enum": [
            "default_template",
            "composition_template"
          ]
        },
        "resolvedBaseTemplateId": {
          "type": "string"
        },
        "compositionTemplateId": {
          "type": [
            "string",
            "null"
          ]
        },
        "iterableTemplateId": {
          "type": [
            "string",
            "null"
          ]
        }
      },
      "additionalProperties": false
    },
    "salutationContext": {
      "type": [
        "string",
        "null"
      ],
      "enum": [
        "generic",
        "rle",
        "loft-snl",
        "loft-rnl-dev",
        "loft-regio-resi",
        null
      ]
    },
    "subject": {
      "type": "string"
    },
    "preheader": {
      "type": "string"
    },
    "modules": {
      "type": "array",
      "items": {
        "type": "object",
        "required": [
          "instance_id",
          "module_id",
          "snippet_name",
          "content"
        ],
        "properties": {
          "instance_id": {
            "type": "string"
          },
          "module_id": {
            "type": "string"
          },
          "snippet_name": {
            "type": "string"
          },
          "content": {
            "type": "object",
            "additionalProperties": true
          },
          "meta": {
            "type": "object",
            "additionalProperties": true
          }
        }
      }
    }
  },
  "x-rules": [
    "Ein email_state ist nur export-ready, wenn subject und preheader vorhanden und nicht leer sind.",
    "Ein export-ready state muss einen eindeutigen templateContext enthalten.",
    "Bei freiem Modulbau, beim Standard-Blueprint und bei editierbaren Starter Blueprints wie ho-esg oder seeker-mle gilt templateContext.mode = default_template und templateContext.resolvedBaseTemplateId = 569946; compositionTemplateId und iterableTemplateId bleiben dabei leer.",
    "Bei Composition-Templates gelten templateContext.mode = composition_template, templateContext.compositionTemplateId, templateContext.iterableTemplateId und templateContext.resolvedBaseTemplateId = templateContext.iterableTemplateId.",
    "salutationContext ist der aufgeloeste Anrede-Kontext aus agent/product-salutations.json oder aus salutation_context_id des aktiven Composition-Templates.",
    "Neue regulaere States sollen salutationContext als registrierte ID tragen; wenn keine eindeutige Zuordnung vorliegt, gilt generic.",
    "campaignId und templateId sind nur die wiederverwendbare Campaign-Bindung; templateContext.resolvedBaseTemplateId bleibt davon getrennt.",
    "Bei Re-Export muessen campaignId, templateId und previewBranchKey eindeutig demselben fortgeschriebenen Preview-/Composition-Zweig zugeordnet sein.",
    "Ein Export einer bestehenden Mail setzt einen bereits vorhandenen und gueltigen email_state voraus; Startlogik, Template-Auswahl und Starter-Auswahl werden dabei nie erneut ausgewertet.",
    "Wenn fuer eine bestehende Mail kein gueltiger email_state vorliegt, stoppt der Export klar statt Preview-HTML, Starter-Dateien, Template-Preview-Dateien oder Modulbibliothek automatisch zur Rekonstruktion zu verwenden.",
    "module_id muss in export-map.json existieren.",
    "snippet_name muss zum module_id in export-map.json passen.",
    "Jeder Key in content muss ein erlaubtes Feld fuer dieses Modul in export-map.json sein.",
    "Wenn eine Felddefinition in export-map.json allowed_values definiert, muss der content-Wert exakt einem dieser erlaubten Werte entsprechen.",
    "Required Felder werden nur aus content oder Default der export-map.json befuellt.",
    "Felder ohne content und ohne Default werden nicht erfunden.",
    "Resolver-Werte sind nur zulaessig, wenn sie vor dem Export bereits konkret im state materialisiert wurden oder aus einer dokumentierten technischen Quelle fail-closed ableitbar sind.",
    "Dokumentierte technische Resolver-Quellen sind nur: Hintergrund-Rhythmus aus builder-library.md plus preview-styles.css, Icon-Auswahl aus icon-library.md, finale Button-Farbwerte aus builder-library.md und kontrollierte Salutation-Feld-Overrides aus product-salutations.json.",
    "Wenn modules eines der Center-Hero-Module hero-image-top-center, hero-image-top-bleed-center, hero-cta-top-center, hero-cta-top-no-bottom-center, hero-image-head-copy-bleed-center, hero-image-textbox-cta-center oder hero-fakeform-buttons-image enthalten, muss ein vorhandenes Logo-Modul als logo-centered vorliegen; ein plain logo ist in diesem Kontext vor dem Export zu normalisieren.",
    "Diese Logo-Normalisierung aendert nur das Logo-Modul, fuegt kein zweites Logo ein und erhaelt die Modulreihenfolge.",
    "Nur Hero-Headlines duerfen im state ueber ein kanonisches Groessenfeld steuerbar sein.",
    "Erlaubte Hero-Groessen sind ausschliesslich s, m und l; ihr Mapping ist direkt heading-s, heading-m und heading-l.",
    "Der regulaere Hero-Default ist l.",
    "Nicht-Hero-Modulheadlines sind nicht usersteuerbar: erste Hauptheadline = heading-m, Unter-Headlines und Abschnittstitel = heading-s, Bodytexte = body-standard.",
    "Freie Heading-Klassen, freie CSS-Werte, freie Font-Size-Werte, freies HTML oder freie Style-Werte sind fuer Typography-Steuerung unzulaessig.",
    "Fuer alle elf Hero-Module ist *_headline_size das kanonische Builder-/Preview-Feld und in export-map.json als erlaubtes State-Feld registriert, aber kein direkter Snippet-Parameter.",
    "Fuer alle elf Hero-Module sind nur s, m und l als headline_size erlaubt; fehlt headline_size oder ist es leer, gilt l als kanonischer Default.",
    "Fuer hero-image-top, hero-image-top-center, hero-image-top-bleed, hero-image-top-bleed-center, hero-image-head-copy-bleed-center, hero-image-textbox-cta-center, hero-fakeform-buttons-image, hero-cta-top, hero-cta-top-center, hero-cta-top-no-bottom und hero-cta-top-no-bottom-center muessen show_small_headline und show_large_headline exakt aus dem kanonischen oder per Default angenommenen headline_size abgeleitet werden.",
    "Die Bridge ist fuer alle Hero-Module fest: s => true/false, m => false/false, l => false/true; true/true ist ungueltig.",
    "Ein fehlendes Hero-headline_size allein macht einen sonst gueltigen State nicht unvollstaendig und darf keinen Recovery-, Preview-, Starter- oder Modul-Rebuild ausloesen.",
    "Required *_bg_color-Felder muessen im content bereits als konkrete Hexwerte aus dem operativen Hintergrund-Rhythmus vorliegen.",
    "theme-white, theme-gray oder andere semantische Preview-Klassen sind keine zulaessigen *_bg_color-Werte im content.",
    "content ist die einzige Exportquelle fuer Iterable-Variablen.",
    "content darf keine freien oder ungeprueften HTML-Werte enthalten.",
    "Normale Text-Felder bleiben Plain Text.",
    "rich_inline darf nur sanitisiertes builder-eigenes Inline-HTML mit den Tags strong, em, a und br enthalten.",
    "rich_full darf nur sanitisiertes builder-eigenes Richtext-HTML mit den Tags p, ul, ol, li, strong, em, a und br enthalten.",
    "Bei a-Tags sind nur href, target und rel erlaubt.",
    "meta enthaelt nur nicht-exportrelevante Informationen wie position oder item_count."
  ]
}
